{
  "$schema": "https://json-schema.org/draft/2020-12/schema",
  "$id": "https://repo-flow.local/schemas/queue-manifest.v1.schema.json",
  "title": "RepoFlow issue queue manifest v1",
  "type": "object",
  "additionalProperties": false,
  "required": ["schemaVersion", "tasks"],
  "properties": {
    "$schema": {
      "type": "string",
      "minLength": 1
    },
    "schemaVersion": {
      "const": 1
    },
    "name": {
      "type": "string",
      "minLength": 1
    },
    "repository": {
      "type": "string",
      "minLength": 1
    },
    "tasks": {
      "type": "array",
      "minItems": 1,
      "items": {
        "type": "object",
        "additionalProperties": false,
        "required": ["issueNumber"],
        "properties": {
          "issueNumber": {
            "type": "integer",
            "minimum": 1
          },
          "repository": {
            "type": "string",
            "minLength": 1
          },
          "ciMode": {
            "type": "string",
            "enum": ["skip", "observe", "require-passing"]
          },
          "automatedReview": {
            "type": "boolean"
          }
        }
      }
    }
  }
}
